{
  "protocol_version": "1.0.0",
  "schema_version": "1.0.0",
  "metric_registry_version": "1.0.0",
  "result_id": "t09-color-science-20260823t165509z",
  "workstream": "color_science",
  "result_status": "COMPLETE",
  "git_commit": "9e90b2fda9a1d5b05d4dd7310c1ff214d103a40b",
  "created_at_utc": "2026-08-23T16:55:09.651822Z",
  "operator": {
    "role": "color_evaluator",
    "identifier": "coordinator-regeneration-from-phong"
  },
  "environment": {
    "host_role": "development",
    "declared_demo_hardware": false,
    "manufacturer": "LENOVO",
    "model": "83DV",
    "operating_system": "Windows-10-10.0.26200-SP0",
    "cpu": "13th Gen Intel(R) Core(TM) i5-13450HX",
    "physical_core_count": 10,
    "logical_processor_count": 16,
    "ram_gib": 15.781120300292969,
    "gpu": "NVIDIA GeForce RTX 4050 Laptop GPU",
    "npu": "USB Input Device; Microsoft Input Configuration Device; USB Input Device; USB Input Device; USB Input Device; USB Input Device",
    "camera_or_source": "tracked digital patches and inline synthetic pairs",
    "python_version": "3.10.20",
    "package_versions": {
      "chromalens-ai": "0.1.0",
      "numpy": "1.26.4",
      "opencv-contrib-python": "4.10.0.84",
      "mediapipe": "0.10.21",
      "daltonlens": "0.1.5"
    },
    "lock_sha256": "23634bd25d39d7f03468afb042526b537af36b5382bf2871ad619066d93bf44e",
    "backend_name": "deterministic-color-science-and-daltonlens-machado2009",
    "backend_device": "cpu",
    "source_kind": "inline_synthetic",
    "source_resolution": {
      "width": 128,
      "height": 128
    },
    "render_resolution": {
      "width": 128,
      "height": 128
    },
    "display_mode": "not_applicable",
    "warmup_seconds": 0.0,
    "measurement_seconds": 0.0,
    "external_measurement_apparatus": null
  },
  "cases": [
    {
      "case_id": "COL-BLACK-DAYLIGHT",
      "status": "NOT_RUN",
      "fixture_id": "physical-basic11-black",
      "artifact_ids": [
        "color-name-matrix",
        "color-science-report"
      ],
      "reason": "exact physical asset remains TO_BE_ACQUIRED; supplemental synthetic evidence is not a replacement"
    },
    {
      "case_id": "COL-BLACK-NEUTRAL",
      "status": "NOT_RUN",
      "fixture_id": "physical-basic11-black",
      "artifact_ids": [
        "color-name-matrix",
        "color-science-report"
      ],
      "reason": "exact physical asset remains TO_BE_ACQUIRED; supplemental synthetic evidence is not a replacement"
    },
    {
      "case_id": "COL-BLACK-WARMLOW",
      "status": "NOT_RUN",
      "fixture_id": "physical-basic11-black",
      "artifact_ids": [
        "color-name-matrix",
        "color-science-report"
      ],
      "reason": "exact physical asset remains TO_BE_ACQUIRED; supplemental synthetic evidence is not a replacement"
    },
    {
      "case_id": "COL-BLUE-DAYLIGHT",
      "status": "NOT_RUN",
      "fixture_id": "physical-basic11-blue",
      "artifact_ids": [
        "color-name-matrix",
        "color-science-report"
      ],
      "reason": "exact physical asset remains TO_BE_ACQUIRED; supplemental synthetic evidence is not a replacement"
    },
    {
      "case_id": "COL-BLUE-NEUTRAL",
      "status": "NOT_RUN",
      "fixture_id": "physical-basic11-blue",
      "artifact_ids": [
        "color-name-matrix",
        "color-science-report"
      ],
      "reason": "exact physical asset remains TO_BE_ACQUIRED; supplemental synthetic evidence is not a replacement"
    },
    {
      "case_id": "COL-BLUE-WARMLOW",
      "status": "NOT_RUN",
      "fixture_id": "physical-basic11-blue",
      "artifact_ids": [
        "color-name-matrix",
        "color-science-report"
      ],
      "reason": "exact physical asset remains TO_BE_ACQUIRED; supplemental synthetic evidence is not a replacement"
    },
    {
      "case_id": "COL-BROWN-DAYLIGHT",
      "status": "NOT_RUN",
      "fixture_id": "physical-basic11-brown",
      "artifact_ids": [
        "color-name-matrix",
        "color-science-report"
      ],
      "reason": "exact physical asset remains TO_BE_ACQUIRED; supplemental synthetic evidence is not a replacement"
    },
    {
      "case_id": "COL-BROWN-NEUTRAL",
      "status": "NOT_RUN",
      "fixture_id": "physical-basic11-brown",
      "artifact_ids": [
        "color-name-matrix",
        "color-science-report"
      ],
      "reason": "exact physical asset remains TO_BE_ACQUIRED; supplemental synthetic evidence is not a replacement"
    },
    {
      "case_id": "COL-BROWN-WARMLOW",
      "status": "NOT_RUN",
      "fixture_id": "physical-basic11-brown",
      "artifact_ids": [
        "color-name-matrix",
        "color-science-report"
      ],
      "reason": "exact physical asset remains TO_BE_ACQUIRED; supplemental synthetic evidence is not a replacement"
    },
    {
      "case_id": "COL-GREY-DAYLIGHT",
      "status": "NOT_RUN",
      "fixture_id": "physical-basic11-grey",
      "artifact_ids": [
        "color-name-matrix",
        "color-science-report"
      ],
      "reason": "exact physical asset remains TO_BE_ACQUIRED; supplemental synthetic evidence is not a replacement"
    },
    {
      "case_id": "COL-GREY-NEUTRAL",
      "status": "NOT_RUN",
      "fixture_id": "physical-basic11-grey",
      "artifact_ids": [
        "color-name-matrix",
        "color-science-report"
      ],
      "reason": "exact physical asset remains TO_BE_ACQUIRED; supplemental synthetic evidence is not a replacement"
    },
    {
      "case_id": "COL-GREY-WARMLOW",
      "status": "NOT_RUN",
      "fixture_id": "physical-basic11-grey",
      "artifact_ids": [
        "color-name-matrix",
        "color-science-report"
      ],
      "reason": "exact physical asset remains TO_BE_ACQUIRED; supplemental synthetic evidence is not a replacement"
    },
    {
      "case_id": "COL-GREEN-DAYLIGHT",
      "status": "NOT_RUN",
      "fixture_id": "physical-basic11-green",
      "artifact_ids": [
        "color-name-matrix",
        "color-science-report"
      ],
      "reason": "exact physical asset remains TO_BE_ACQUIRED; supplemental synthetic evidence is not a replacement"
    },
    {
      "case_id": "COL-GREEN-NEUTRAL",
      "status": "NOT_RUN",
      "fixture_id": "physical-basic11-green",
      "artifact_ids": [
        "color-name-matrix",
        "color-science-report"
      ],
      "reason": "exact physical asset remains TO_BE_ACQUIRED; supplemental synthetic evidence is not a replacement"
    },
    {
      "case_id": "COL-GREEN-WARMLOW",
      "status": "NOT_RUN",
      "fixture_id": "physical-basic11-green",
      "artifact_ids": [
        "color-name-matrix",
        "color-science-report"
      ],
      "reason": "exact physical asset remains TO_BE_ACQUIRED; supplemental synthetic evidence is not a replacement"
    },
    {
      "case_id": "COL-ORANGE-DAYLIGHT",
      "status": "NOT_RUN",
      "fixture_id": "physical-basic11-orange",
      "artifact_ids": [
        "color-name-matrix",
        "color-science-report"
      ],
      "reason": "exact physical asset remains TO_BE_ACQUIRED; supplemental synthetic evidence is not a replacement"
    },
    {
      "case_id": "COL-ORANGE-NEUTRAL",
      "status": "NOT_RUN",
      "fixture_id": "physical-basic11-orange",
      "artifact_ids": [
        "color-name-matrix",
        "color-science-report"
      ],
      "reason": "exact physical asset remains TO_BE_ACQUIRED; supplemental synthetic evidence is not a replacement"
    },
    {
      "case_id": "COL-ORANGE-WARMLOW",
      "status": "NOT_RUN",
      "fixture_id": "physical-basic11-orange",
      "artifact_ids": [
        "color-name-matrix",
        "color-science-report"
      ],
      "reason": "exact physical asset remains TO_BE_ACQUIRED; supplemental synthetic evidence is not a replacement"
    },
    {
      "case_id": "COL-PINK-DAYLIGHT",
      "status": "NOT_RUN",
      "fixture_id": "physical-basic11-pink",
      "artifact_ids": [
        "color-name-matrix",
        "color-science-report"
      ],
      "reason": "exact physical asset remains TO_BE_ACQUIRED; supplemental synthetic evidence is not a replacement"
    },
    {
      "case_id": "COL-PINK-NEUTRAL",
      "status": "NOT_RUN",
      "fixture_id": "physical-basic11-pink",
      "artifact_ids": [
        "color-name-matrix",
        "color-science-report"
      ],
      "reason": "exact physical asset remains TO_BE_ACQUIRED; supplemental synthetic evidence is not a replacement"
    },
    {
      "case_id": "COL-PINK-WARMLOW",
      "status": "NOT_RUN",
      "fixture_id": "physical-basic11-pink",
      "artifact_ids": [
        "color-name-matrix",
        "color-science-report"
      ],
      "reason": "exact physical asset remains TO_BE_ACQUIRED; supplemental synthetic evidence is not a replacement"
    },
    {
      "case_id": "COL-PURPLE-DAYLIGHT",
      "status": "NOT_RUN",
      "fixture_id": "physical-basic11-purple",
      "artifact_ids": [
        "color-name-matrix",
        "color-science-report"
      ],
      "reason": "exact physical asset remains TO_BE_ACQUIRED; supplemental synthetic evidence is not a replacement"
    },
    {
      "case_id": "COL-PURPLE-NEUTRAL",
      "status": "NOT_RUN",
      "fixture_id": "physical-basic11-purple",
      "artifact_ids": [
        "color-name-matrix",
        "color-science-report"
      ],
      "reason": "exact physical asset remains TO_BE_ACQUIRED; supplemental synthetic evidence is not a replacement"
    },
    {
      "case_id": "COL-PURPLE-WARMLOW",
      "status": "NOT_RUN",
      "fixture_id": "physical-basic11-purple",
      "artifact_ids": [
        "color-name-matrix",
        "color-science-report"
      ],
      "reason": "exact physical asset remains TO_BE_ACQUIRED; supplemental synthetic evidence is not a replacement"
    },
    {
      "case_id": "COL-RED-DAYLIGHT",
      "status": "NOT_RUN",
      "fixture_id": "physical-basic11-red",
      "artifact_ids": [
        "color-name-matrix",